{
  "ID": 31,
  "q_ch": "Premier Sewers的缝纫任务有哪些？",
  "q_en": "What are the sewing tasks of Premier Sewers?",
  "thought": "To retrieve the sewing tasks of Premier Sewers, we need to join the 'sewing_tasks' table with the 'working_group' table on the 'working_group_id' foreign key. Then, we need to filter the results where the 'working_group' type is 'sew' and the 'working_group' name is 'Premier Sewers'.",
  "sqls": [
    {
      "command": "SELECT * FROM sewing_tasks JOIN working_group ON sewing_tasks.working_group_id = working_group.id WHERE working_group.type = 'sew' AND working_group.name = 'Premier Sewers';",
      "execution time": "0.0011496543884277344",
      "Result of executing SQL": [
        {
          "id": "sw11",
          "start_time": "2024年03月21日 00:00",
          "end_time": "2024年04月14日 00:00",
          "working_group_id": "wg9",
          "order_product_id": "op11",
          "planned_number": 140,
          "completed_number": 140,
          "is_started": 1,
          "working_group.id": "wg9",
          "type": "sew",
          "name": "Premier Sewers"
        },
        {
          "id": "sw2",
          "start_time": "2024年02月02日 00:00",
          "end_time": "2024年02月15日 00:00",
          "working_group_id": "wg9",
          "order_product_id": "op2",
          "planned_number": 240,
          "completed_number": 240,
          "is_started": 1,
          "working_group.id": "wg9",
          "type": "sew",
          "name": "Premier Sewers"
        },
        {
          "id": "sw26",
          "start_time": "2024年05月04日 00:00",
          "end_time": "2024年05月15日 00:00",
          "working_group_id": "wg9",
          "order_product_id": "op26",
          "planned_number": 70,
          "completed_number": 70,
          "is_started": 1,
          "working_group.id": "wg9",
          "type": "sew",
          "name": "Premier Sewers"
        },
        {
          "id": "sw3",
          "start_time": "2024年01月19日 00:00",
          "end_time": "2024年02月08日 00:00",
          "working_group_id": "wg9",
          "order_product_id": "op3",
          "planned_number": 150,
          "completed_number": 150,
          "is_started": 1,
          "working_group.id": "wg9",
          "type": "sew",
          "name": "Premier Sewers"
        },
        {
          "id": "sw32",
          "start_time": "2024年06月17日 00:00",
          "end_time": "2024年07月14日 00:00",
          "working_group_id": "wg9",
          "order_product_id": "op32",
          "planned_number": 150,
          "completed_number": 0,
          "is_started": 0,
          "working_group.id": "wg9",
          "type": "sew",
          "name": "Premier Sewers"
        }
      ]
    }
  ],
  "answer": "Based on the provided data, the sewing tasks of Premier Sewers are as follows:\n1. Task ID: sw11, Start Time: 2024年03月21日 00:00, End Time: 2024年04月14日 00:00, Planned Number: 140, Completed Number: 140, Status: In Progress\n2. Task ID: sw2, Start Time: 2024年02月02日 00:00, End Time: 2024年02月15日 00:00, Planned Number: 240, Completed Number: 240, Status: Completed\n3. Task ID: sw26, Start Time: 2024年05月04日 00:00, End Time: 2024年05月15日 00:00, Planned Number: 70, Completed Number: 70, Status: Completed\n4. Task ID: sw3, Start Time: 2024年01月19日 00:00, End Time: 2024年02月08日 00:00, Planned Number: 150, Completed Number: 150, Status: Completed\n5. Task ID: sw32, Start Time: 2024年06月17日 00:00, End Time: 2024年07月14日 00:00, Planned Number: 150, Completed Number: 0, Status: Not Started",
  "tokens": {
    "completion_tokens": "125",
    "prompt_tokens": "1884",
    "total_tokens": "2009"
  }
}