{"ID": 32, "q_ch": "产品类型是Dress的缝纫任务有哪些？", "q_en": "What are the sewing tasks for Dress's product type?", "thought": "To retrieve the sewing tasks for Dress's product type, we need to first identify the 'products' table entry for the Dress product type. Then, we can use the product_id to query the 'order_product' table to get the corresponding order_product_id. Finally, we can query the 'sewing_tasks' table using the order_product_id to fetch the sewing tasks for the Dress's product type.", "sqls": [{"command": "SELECT st.* FROM sewing_tasks st JOIN order_product op ON st.order_product_id = op.id JOIN products p ON op.product_id = p.id JOIN products_types pt ON p.products_type_id = pt.id WHERE pt.description = 'Dress';", "execution time": "0.009903430938720703", "Result of executing SQL": [{"id": "sw13", "start_time": "2024年03月27日 00:00", "end_time": "2024年04月06日 00:00", "working_group_id": "wg6", "order_product_id": "op13", "planned_number": 130, "completed_number": 130, "is_started": 1}, {"id": "sw11", "start_time": "2024年03月21日 00:00", "end_time": "2024年04月14日 00:00", "working_group_id": "wg9", "order_product_id": "op11", "planned_number": 140, "completed_number": 140, "is_started": 1}, {"id": "sw12", "start_time": "2024年03月27日 00:00", "end_time": "2024年04月12日 00:00", "working_group_id": "wg6", "order_product_id": "op12", "planned_number": 150, "completed_number": 150, "is_started": 1}, {"id": "sw14", "start_time": "2024年03月18日 00:00", "end_time": "2024年04月08日 00:00", "working_group_id": "wg6", "order_product_id": "op14", "planned_number": 120, "completed_number": 120, "is_started": 1}]}], "answer": "Based on the data retrieved from the database, the sewing tasks for the product type 'Dress' are as follows:\n\n1. Sewing Task ID: sw13\n   - Start Time: 2024年03月27日 00:00\n   - End Time: 2024年04月06日 00:00\n   - Working Group ID: wg6\n   - Order Product ID: op13\n   - Planned Number: 130\n   - Completed Number: 130\n   - Is Started: Yes\n\n2. Sewing Task ID: sw11\n   - Start Time: 2024年03月21日 00:00\n   - End Time: 2024年04月14日 00:00\n   - Working Group ID: wg9\n   - Order Product ID: op11\n   - Planned Number: 140\n   - Completed Number: 140\n   - Is Started: Yes\n\n3. Sewing Task ID: sw12\n   - Start Time: 2024年03月27日 00:00\n   - End Time: 2024年04月12日 00:00\n   - Working Group ID: wg6\n   - Order Product ID: op12\n   - Planned Number: 150\n   - Completed Number: 150\n   - Is Started: Yes\n\n4. Sewing Task ID: sw14\n   - Start Time: 2024年03月18日 00:00\n   - End Time: 2024年04月08日 00:00\n   - Working Group ID: wg6\n   - Order Product ID: op14\n   - Planned Number: 120\n   - Completed Number: 120\n   - Is Started: Yes\n\nThese sewing tasks are associated with the product type 'Dress' based on the SQL query used to retrieve the data."}