{"ID": 33, "q_ch": "分配给Precision Cutters的裁剪任务有哪些？", "q_en": "What are the cutting tasks assigned to Precision Cutters?", "thought": "To find the cutting tasks assigned to Precision Cutters, we need to retrieve the cutting tasks that are associated with the working group 'Precision Cutters'. We will first need to get the ID of the 'Precision Cutters' working group from the 'working_group' table and then use that ID to query the 'cutting_tasks' table to retrieve the cutting tasks.", "sqls": [{"command": "SELECT * FROM cutting_tasks WHERE working_group_id = (SELECT id FROM working_group WHERE name = 'Precision Cutters');", "execution time": "0.006653308868408203", "Result of executing SQL": [{"id": "ct18", "start_time": "2024年03月11日 00:00", "end_time": "2024年04月07日 00:00", "working_group_id": "wg1", "order_product_id": "op18", "planned_number": 200, "completed_number": 200, "is_started": 1}, {"id": "ct30", "start_time": "2024年04月19日 00:00", "end_time": "2024年04月26日 00:00", "working_group_id": "wg1", "order_product_id": "op30", "planned_number": 195, "completed_number": 195, "is_started": 1}]}], "answer": "Based on the data retrieved from the database using the provided SQL query, the cutting tasks assigned to Precision Cutters working group are:\n\n1. Task ID: ct18\n   - Start Time: 2024年03月11日 00:00\n   - End Time: 2024年04月07日 00:00\n   - Order Product ID: op18\n   - Planned Number: 200\n   - Completed Number: 200\n   - Is Started: Yes\n\n2. Task ID: ct30\n   - Start Time: 2024年04月19日 00:00\n   - End Time: 2024年04月26日 00:00\n   - Order Product ID: op30\n   - Planned Number: 195\n   - Completed Number: 195\n   - Is Started: Yes\n\nThese are the cutting tasks assigned to the Precision Cutters working group based on the retrieved data."}