{
  "ID": 16,
  "q_ch": "2024年5月1日后才开始的裁剪任务有哪些？",
  "q_en": "What are the cutting tasks that will only start after May 1, 2024?",
  "thought": "To find all cutting tasks that will start after May 1, 2024, I need to select from the `cutting_tasks` table where the `start_time` is greater than the specified date.",
  "sqls": [
    {
      "command": "SELECT * FROM `cutting_tasks` WHERE `start_time` > '2024-05-01 00:00:00';",
      "execution time": "0.0007565021514892578",
      "Result of executing SQL": [
        {
          "id": "ct31",
          "start_time": "2024年05月10日 00:00",
          "end_time": "2024年05月26日 00:00",
          "working_group_id": "wg3",
          "order_product_id": "op31",
          "planned_number": 260,
          "completed_number": 260,
          "is_started": 1
        },
        {
          "id": "ct32",
          "start_time": "2024年06月01日 00:00",
          "end_time": "2024年06月17日 00:00",
          "working_group_id": "wg2",
          "order_product_id": "op32",
          "planned_number": 150,
          "completed_number": 120,
          "is_started": 1
        },
        {
          "id": "ct33",
          "start_time": "2024年06月25日 00:00",
          "end_time": "2024年07月17日 00:00",
          "working_group_id": "wg3",
          "order_product_id": "op33",
          "planned_number": 120,
          "completed_number": 0,
          "is_started": 0
        },
        {
          "id": "ct34",
          "start_time": "2024年06月30日 00:00",
          "end_time": "2024年07月10日 00:00",
          "working_group_id": "wg6",
          "order_product_id": "op34",
          "planned_number": 330,
          "completed_number": 0,
          "is_started": 0
        }
      ]
    }
  ],
  "answer": "The cutting tasks that will start after May 1, 2024, are:\n\n1. **Task ID: ct31**\n   - Start Time: 2024年05月10日 00:00\n   - End Time: 2024年05月26日 00:00\n   - Working Group ID: wg3\n   - Order Product ID: op31\n   - Planned Number: 260\n   - Completed Number: 260\n   - Is Started: Yes\n\n2. **Task ID: ct32**\n   - Start Time: 2024年06月01日 00:00\n   - End Time: 2024年06月17日 00:00\n   - Working Group ID: wg2\n   - Order Product ID: op32\n   - Planned Number: 150\n   - Completed Number: 120\n   - Is Started: Yes\n\n3. **Task ID: ct33**\n   - Start Time: 2024年06月25日 00:00\n   - End Time: 2024年07月17日 00:00\n   - Working Group ID: wg3\n   - Order Product ID: op33\n   - Planned Number: 120\n   - Completed Number: 0\n   - Is Started: No\n\n4. **Task ID: ct34**\n   - Start Time: 2024年06月30日 00:00\n   - End Time: 2024年07月10日 00:00\n   - Working Group ID: wg6\n   - Order Product ID: op34\n   - Planned Number: 330\n   - Completed Number: 0\n   - Is Started: No",
  "tokens": {
    "completion_tokens": "83",
    "prompt_tokens": "1844",
    "total_tokens": "1927"
  }
}