{
  "ID": 18,
  "q_ch": "使用 Cotton Fabric 的裁剪任务有哪些？",
  "q_en": "Which cutting tasks use Cotton Fabric?",
  "thought": "To identify which cutting tasks use 'Cotton Fabric', we need to follow these key steps: 1) Identify the material ID for 'Cotton Fabric' from the materials table. 2) Find the corresponding warehouse material ID from the warehouse_material table. 3) Identify the cutting tasks that are assigned this material from the cutting_material_allocation table. 4) Join the cutting tasks table with the cutting_material_allocation table to filter out the relevant cutting tasks.",
  "sqls": [
    {
      "command": "SELECT ct.* FROM materials m JOIN warehouse_material wm ON m.id = wm.material_id JOIN cutting_material_allocation cma ON wm.id = cma.warehouse_material_id JOIN cutting_tasks ct ON cma.cutting_task_id = ct.id WHERE m.name = 'Cotton Fabric';",
      "execution time": "0.001992940902709961",
      "Result of executing SQL": [
        {
          "id": "ct1",
          "start_time": "2024年01月10日 00:00",
          "end_time": "2024年01月18日 00:00",
          "working_group_id": "wg2",
          "order_product_id": "op1",
          "planned_number": 100,
          "completed_number": 100,
          "is_started": 1
        },
        {
          "id": "ct2",
          "start_time": "2024年01月10日 00:00",
          "end_time": "2024年02月02日 00:00",
          "working_group_id": "wg3",
          "order_product_id": "op2",
          "planned_number": 240,
          "completed_number": 240,
          "is_started": 1
        },
        {
          "id": "ct19",
          "start_time": "2024年03月18日 00:00",
          "end_time": "2024年04月12日 00:00",
          "working_group_id": "wg4",
          "order_product_id": "op19",
          "planned_number": 95,
          "completed_number": 95,
          "is_started": 1
        },
        {
          "id": "ct3",
          "start_time": "2024年01月10日 00:00",
          "end_time": "2024年01月19日 00:00",
          "working_group_id": "wg3",
          "order_product_id": "op3",
          "planned_number": 150,
          "completed_number": 150,
          "is_started": 1
        },
        {
          "id": "ct21",
          "start_time": "2024年03月18日 00:00",
          "end_time": "2024年04月04日 00:00",
          "working_group_id": "wg4",
          "order_product_id": "op21",
          "planned_number": 85,
          "completed_number": 85,
          "is_started": 1
        },
        {
          "id": "ct4",
          "start_time": "2024年01月10日 00:00",
          "end_time": "2024年01月17日 00:00",
          "working_group_id": "wg2",
          "order_product_id": "op4",
          "planned_number": 220,
          "completed_number": 220,
          "is_started": 1
        },
        {
          "id": "ct28",
          "start_time": "2024年04月19日 00:00",
          "end_time": "2024年05月12日 00:00",
          "working_group_id": "wg2",
          "order_product_id": "op28",
          "planned_number": 210,
          "completed_number": 210,
          "is_started": 1
        },
        {
          "id": "ct31",
          "start_time": "2024年05月10日 00:00",
          "end_time": "2024年05月26日 00:00",
          "working_group_id": "wg3",
          "order_product_id": "op31",
          "planned_number": 260,
          "completed_number": 260,
          "is_started": 1
        },
        {
          "id": "ct5",
          "start_time": "2024年01月10日 00:00",
          "end_time": "2024年02月02日 00:00",
          "working_group_id": "wg2",
          "order_product_id": "op5",
          "planned_number": 260,
          "completed_number": 260,
          "is_started": 1
        },
        {
          "id": "ct34",
          "start_time": "2024年06月30日 00:00",
          "end_time": "2024年07月10日 00:00",
          "working_group_id": "wg6",
          "order_product_id": "op34",
          "planned_number": 330,
          "completed_number": 0,
          "is_started": 0
        }
      ]
    }
  ],
  "answer": "The cutting tasks that use Cotton Fabric are as follows:\n\n1. Task ID: ct1\n   - Start Time: 2024年01月10日 00:00\n   - End Time: 2024年01月18日 00:00\n   - Working Group ID: wg2\n   - Order Product ID: op1\n   - Planned Number: 100\n   - Completed Number: 100\n   - Is Started: Yes\n\n2. Task ID: ct2\n   - Start Time: 2024年01月10日 00:00\n   - End Time: 2024年02月02日 00:00\n   - Working Group ID: wg3\n   - Order Product ID: op2\n   - Planned Number: 240\n   - Completed Number: 240\n   - Is Started: Yes\n\n3. Task ID: ct19\n   - Start Time: 2024年03月18日 00:00\n   - End Time: 2024年04月12日 00:00\n   - Working Group ID: wg4\n   - Order Product ID: op19\n   - Planned Number: 95\n   - Completed Number: 95\n   - Is Started: Yes\n\n4. Task ID: ct3\n   - Start Time: 2024年01月10日 00:00\n   - End Time: 2024年01月19日 00:00\n   - Working Group ID: wg3\n   - Order Product ID: op3\n   - Planned Number: 150\n   - Completed Number: 150\n   - Is Started: Yes\n\n5. Task ID: ct21\n   - Start Time: 2024年03月18日 00:00\n   - End Time: 2024年04月04日 00:00\n   - Working Group ID: wg4\n   - Order Product ID: op21\n   - Planned Number: 85\n   - Completed Number: 85\n   - Is Started: Yes\n\n6. Task ID: ct4\n   - Start Time: 2024年01月10日 00:00\n   - End Time: 2024年01月17日 00:00\n   - Working Group ID: wg2\n   - Order Product ID: op4\n   - Planned Number: 220\n   - Completed Number: 220\n   - Is Started: Yes\n\n7. Task ID: ct28\n   - Start Time: 2024年04月19日 00:00\n   - End Time: 2024年05月12日 00:00\n   - Working Group ID: wg2\n   - Order Product ID: op28\n   - Planned Number: 210\n   - Completed Number: 210\n   - Is Started: Yes\n\n8. Task ID: ct31\n   - Start Time: 2024年05月10日 00:00\n   - End Time: 2024年05月26日 00:00\n   - Working Group ID: wg3\n   - Order Product ID: op31\n   - Planned Number: 260\n   - Completed Number: 260\n   - Is Started: Yes\n\n9. Task ID: ct5\n   - Start Time: 2024年01月10日 00:00\n   - End Time: 2024年02月02日 00:00\n   - Working Group ID: wg2\n   - Order Product ID: op5\n   - Planned Number: 260\n   - Completed Number: 260\n   - Is Started: Yes\n\n10. Task ID: ct34\n   - Start Time: 2024年06月30日 00:00\n   - End Time: 2024年07月10日 00:00\n   - Working Group ID: wg6\n   - Order Product ID: op34\n   - Planned Number: 330\n   - Completed Number: 0\n   - Is Started: No",
  "tokens": {
    "completion_tokens": "165",
    "prompt_tokens": "1833",
    "total_tokens": "1998"
  }
}