{
  "ID": 19,
  "q_ch": "使用 Silk 的缝纫任务有哪些？",
  "q_en": "Which sewing tasks use Silk?",
  "thought": "To identify the sewing tasks that use Silk, we need to first find the material ID for Silk in the `materials` table. Then, we join the `warehouse_material` table to find the related warehouse_material IDs. Using these IDs, we can join the `sewing_material_allocation` table to find the corresponding sewing_task IDs. Finally, we join the `sewing_tasks` table to get the relevant sewing task details.",
  "sqls": [
    {
      "command": "SELECT st.* FROM sewing_tasks st JOIN sewing_material_allocation sma ON st.id = sma.sewing_task_id JOIN warehouse_material wm ON sma.warehouse_material_id = wm.id JOIN materials m ON wm.material_id = m.id WHERE m.name = 'Silk';",
      "execution time": "0.0",
      "Result of executing SQL": [
        {
          "id": "sw11",
          "start_time": "2024年03月21日 00:00",
          "end_time": "2024年04月14日 00:00",
          "working_group_id": "wg9",
          "order_product_id": "op11",
          "planned_number": 140,
          "completed_number": 140,
          "is_started": 1
        },
        {
          "id": "sw12",
          "start_time": "2024年03月27日 00:00",
          "end_time": "2024年04月12日 00:00",
          "working_group_id": "wg2",
          "order_product_id": "op12",
          "planned_number": 150,
          "completed_number": 150,
          "is_started": 1
        },
        {
          "id": "sw13",
          "start_time": "2024年03月27日 00:00",
          "end_time": "2024年04月06日 00:00",
          "working_group_id": "wg2",
          "order_product_id": "op13",
          "planned_number": 130,
          "completed_number": 130,
          "is_started": 1
        },
        {
          "id": "sw14",
          "start_time": "2024年03月18日 00:00",
          "end_time": "2024年04月08日 00:00",
          "working_group_id": "wg2",
          "order_product_id": "op14",
          "planned_number": 120,
          "completed_number": 120,
          "is_started": 1
        }
      ]
    }
  ],
  "answer": "The sewing tasks that use Silk are:\n\n1. Task ID: sw11\n   - Start Time: 2024年03月21日 00:00\n   - End Time: 2024年04月14日 00:00\n   - Working Group ID: wg9\n   - Order Product ID: op11\n   - Planned Number: 140\n   - Completed Number: 140\n   - Is Started: Yes\n\n2. Task ID: sw12\n   - Start Time: 2024年03月27日 00:00\n   - End Time: 2024年04月12日 00:00\n   - Working Group ID: wg2\n   - Order Product ID: op12\n   - Planned Number: 150\n   - Completed Number: 150\n   - Is Started: Yes\n\n3. Task ID: sw13\n   - Start Time: 2024年03月27日 00:00\n   - End Time: 2024年04月06日 00:00\n   - Working Group ID: wg2\n   - Order Product ID: op13\n   - Planned Number: 130\n   - Completed Number: 130\n   - Is Started: Yes\n\n4. Task ID: sw14\n   - Start Time: 2024年03月18日 00:00\n   - End Time: 2024年04月08日 00:00\n   - Working Group ID: wg2\n   - Order Product ID: op14\n   - Planned Number: 120\n   - Completed Number: 120\n   - Is Started: Yes",
  "tokens": {
    "completion_tokens": "153",
    "prompt_tokens": "1832",
    "total_tokens": "1985"
  }
}