{
  "ID": 25,
  "q_ch": "对于Master Sewers 已经完成的所有缝纫任务，有哪些是在2024年2月1日之后创建的?",
  "q_en": "For all sewing tasks completed by Master Sewers, which ones were created after February 1, 2024?",
  "thought": "To find all sewing tasks completed by 'Master Sewers' after February 1, 2024, we need to first join the sewing_tasks table with the working_group table to filter by the working group name 'Master Sewers' and the completion status, then filter for tasks created after February 1, 2024.",
  "sqls": [
    {
      "command": "SELECT st.* FROM sewing_tasks st JOIN working_group wg ON st.working_group_id = wg.id WHERE wg.name = 'Master Sewers' AND st.completed_number > 0 AND st.start_time > '2024-02-01 00:00:00';",
      "execution time": "0.0010077953338623047",
      "Result of executing SQL": [
        {
          "id": "sw10",
          "start_time": "2024年03月29日 00:00",
          "end_time": "2024年04月09日 00:00",
          "working_group_id": "wg2",
          "order_product_id": "op10",
          "planned_number": 100,
          "completed_number": 100,
          "is_started": 1
        },
        {
          "id": "sw12",
          "start_time": "2024年03月27日 00:00",
          "end_time": "2024年04月12日 00:00",
          "working_group_id": "wg2",
          "order_product_id": "op12",
          "planned_number": 150,
          "completed_number": 150,
          "is_started": 1
        },
        {
          "id": "sw13",
          "start_time": "2024年03月27日 00:00",
          "end_time": "2024年04月06日 00:00",
          "working_group_id": "wg2",
          "order_product_id": "op13",
          "planned_number": 130,
          "completed_number": 130,
          "is_started": 1
        },
        {
          "id": "sw14",
          "start_time": "2024年03月18日 00:00",
          "end_time": "2024年04月08日 00:00",
          "working_group_id": "wg2",
          "order_product_id": "op14",
          "planned_number": 120,
          "completed_number": 120,
          "is_started": 1
        },
        {
          "id": "sw15",
          "start_time": "2024年03月26日 00:00",
          "end_time": "2024年04月09日 00:00",
          "working_group_id": "wg2",
          "order_product_id": "op15",
          "planned_number": 185,
          "completed_number": 185,
          "is_started": 1
        },
        {
          "id": "sw24",
          "start_time": "2024年04月23日 00:00",
          "end_time": "2024年05月20日 00:00",
          "working_group_id": "wg2",
          "order_product_id": "op24",
          "planned_number": 105,
          "completed_number": 105,
          "is_started": 1
        },
        {
          "id": "sw30",
          "start_time": "2024年04月26日 00:00",
          "end_time": "2024年05月15日 00:00",
          "working_group_id": "wg2",
          "order_product_id": "op30",
          "planned_number": 195,
          "completed_number": 195,
          "is_started": 1
        },
        {
          "id": "sw5",
          "start_time": "2024年02月02日 00:00",
          "end_time": "2024年02月25日 00:00",
          "working_group_id": "wg2",
          "order_product_id": "op5",
          "planned_number": 260,
          "completed_number": 260,
          "is_started": 1
        }
      ]
    }
  ],
  "answer": "Based on the provided data and the SQL query specified, the sewing tasks completed by the Master Sewers working group and created after February 1, 2024 are:\n\n1. Task ID: sw10\n   - Start Time: 2024年03月29日 00:00\n   - End Time: 2024年04月09日 00:00\n   - Order Product ID: op10\n   - Planned Number: 100\n   - Completed Number: 100\n\n2. Task ID: sw12\n   - Start Time: 2024年03月27日 00:00\n   - End Time: 2024年04月12日 00:00\n   - Order Product ID: op12\n   - Planned Number: 150\n   - Completed Number: 150\n\n3. Task ID: sw13\n   - Start Time: 2024年03月27日 00:00\n   - End Time: 2024年04月06日 00:00\n   - Order Product ID: op13\n   - Planned Number: 130\n   - Completed Number: 130\n\n4. Task ID: sw14\n   - Start Time: 2024年03月18日 00:00\n   - End Time: 2024年04月08日 00:00\n   - Order Product ID: op14\n   - Planned Number: 120\n   - Completed Number: 120\n\n5. Task ID: sw15\n   - Start Time: 2024年03月26日 00:00\n   - End Time: 2024年04月09日 00:00\n   - Order Product ID: op15\n   - Planned Number: 185\n   - Completed Number: 185\n\n6. Task ID: sw24\n   - Start Time: 2024年04月23日 00:00\n   - End Time: 2024年05月20日 00:00\n   - Order Product ID: op24\n   - Planned Number: 105\n   - Completed Number: 105\n\n7. Task ID: sw30\n   - Start Time: 2024年04月26日 00:00\n   - End Time: 2024年05月15日 00:00\n   - Order Product ID: op30\n   - Planned Number: 195\n   - Completed Number: 195\n\n8. Task ID: sw5\n   - Start Time: 2024年02月02日 00:00\n   - End Time: 2024年02月25日 00:00\n   - Order Product ID: op5\n   - Planned Number: 260\n   - Completed Number: 260",
  "tokens": {
    "completion_tokens": "134",
    "prompt_tokens": "1849",
    "total_tokens": "1983"
  }
}