{
  "ID": 39,
  "q_ch": "使用 Leather 的裁剪任务有哪些？",
  "q_en": "Which cutting tasks use Leather?",
  "thought": "To identify which cutting tasks use leather, we need to trace the relationships from materials to the cutting tasks. We'll start by identifying the materials that are leather, then find their allocations in the cutting_material_allocation table, and finally retrieve the related cutting tasks.",
  "sqls": [
    {
      "command": "SELECT cutting_tasks.* FROM cutting_tasks JOIN cutting_material_allocation ON cutting_tasks.id = cutting_material_allocation.cutting_task_id JOIN warehouse_material ON cutting_material_allocation.warehouse_material_id = warehouse_material.id JOIN materials ON warehouse_material.material_id = materials.id WHERE materials.name = 'Leather';",
      "execution time": "0.000972747802734375",
      "Result of executing SQL": [
        {
          "id": "ct15",
          "start_time": "2024年03月11日 00:00",
          "end_time": "2024年03月26日 00:00",
          "working_group_id": "wg2",
          "order_product_id": "op15",
          "planned_number": 185,
          "completed_number": 185,
          "is_started": 1
        },
        {
          "id": "ct16",
          "start_time": "2024年03月11日 00:00",
          "end_time": "2024年04月10日 00:00",
          "working_group_id": "wg4",
          "order_product_id": "op16",
          "planned_number": 200,
          "completed_number": 200,
          "is_started": 1
        },
        {
          "id": "ct17",
          "start_time": "2024年03月11日 00:00",
          "end_time": "2024年03月25日 00:00",
          "working_group_id": "wg2",
          "order_product_id": "op17",
          "planned_number": 175,
          "completed_number": 175,
          "is_started": 1
        },
        {
          "id": "ct18",
          "start_time": "2024年03月11日 00:00",
          "end_time": "2024年04月07日 00:00",
          "working_group_id": "wg1",
          "order_product_id": "op18",
          "planned_number": 200,
          "completed_number": 200,
          "is_started": 1
        },
        {
          "id": "ct20",
          "start_time": "2024年03月18日 00:00",
          "end_time": "2024年04月15日 00:00",
          "working_group_id": "wg4",
          "order_product_id": "op20",
          "planned_number": 90,
          "completed_number": 90,
          "is_started": 1
        },
        {
          "id": "ct25",
          "start_time": "2024年04月14日 00:00",
          "end_time": "2024年05月14日 00:00",
          "working_group_id": "wg2",
          "order_product_id": "op25",
          "planned_number": 75,
          "completed_number": 75,
          "is_started": 1
        },
        {
          "id": "ct27",
          "start_time": "2024年04月14日 00:00",
          "end_time": "2024年05月04日 00:00",
          "working_group_id": "wg4",
          "order_product_id": "op27",
          "planned_number": 60,
          "completed_number": 60,
          "is_started": 1
        },
        {
          "id": "ct32",
          "start_time": "2024年06月01日 00:00",
          "end_time": "2024年06月17日 00:00",
          "working_group_id": "wg2",
          "order_product_id": "op32",
          "planned_number": 150,
          "completed_number": 120,
          "is_started": 1
        }
      ]
    }
  ],
  "answer": "Based on the data retrieved from the database, the cutting tasks that use Leather are:\n\n1. Task ID: ct15\n   - Start Time: 2024年03月11日 00:00\n   - End Time: 2024年03月26日 00:00\n   - Working Group ID: wg2\n   - Order Product ID: op15\n   - Planned Number: 185\n   - Completed Number: 185\n   - Is Started: Yes\n\n2. Task ID: ct16\n   - Start Time: 2024年03月11日 00:00\n   - End Time: 2024年04月10日 00:00\n   - Working Group ID: wg4\n   - Order Product ID: op16\n   - Planned Number: 200\n   - Completed Number: 200\n   - Is Started: Yes\n\n3. Task ID: ct17\n   - Start Time: 2024年03月11日 00:00\n   - End Time: 2024年03月25日 00:00\n   - Working Group ID: wg2\n   - Order Product ID: op17\n   - Planned Number: 175\n   - Completed Number: 175\n   - Is Started: Yes\n\n4. Task ID: ct18\n   - Start Time: 2024年03月11日 00:00\n   - End Time: 2024年04月07日 00:00\n   - Working Group ID: wg1\n   - Order Product ID: op18\n   - Planned Number: 200\n   - Completed Number: 200\n   - Is Started: Yes\n\n5. Task ID: ct20\n   - Start Time: 2024年03月18日 00:00\n   - End Time: 2024年04月15日 00:00\n   - Working Group ID: wg4\n   - Order Product ID: op20\n   - Planned Number: 90\n   - Completed Number: 90\n   - Is Started: Yes\n\n6. Task ID: ct25\n   - Start Time: 2024年04月14日 00:00\n   - End Time: 2024年05月14日 00:00\n   - Working Group ID: wg2\n   - Order Product ID: op25\n   - Planned Number: 75\n   - Completed Number: 75\n   - Is Started: Yes\n\n7. Task ID: ct27\n   - Start Time: 2024年04月14日 00:00\n   - End Time: 2024年05月04日 00:00\n   - Working Group ID: wg4\n   - Order Product ID: op27\n   - Planned Number: 60\n   - Completed Number: 60\n   - Is Started: Yes\n\n8. Task ID: ct32\n   - Start Time: 2024年06月01日 00:00\n   - End Time: 2024年06月17日 00:00\n   - Working Group ID: wg2\n   - Order Product ID: op32\n   - Planned Number: 150\n   - Completed Number: 120\n   - Is Started: Yes",
  "tokens": {
    "completion_tokens": "122",
    "prompt_tokens": "1832",
    "total_tokens": "1954"
  }
}