{
  "ID": 40,
  "q_ch": "订单产品是T恤的裁剪任务有哪些？",
  "q_en": "Which cutting tasks are for products categorized as T-shirt?",
  "thought": "To find cutting tasks for products categorized as T-shirt, we need to join the relevant tables. We'll join the 'cutting_tasks' table with 'order_product', 'products', and 'products_types' tables. We'll filter the results based on the product type description that should be 'T-shirt'.",
  "sqls": [
    {
      "command": "SELECT ct.id, ct.start_time, ct.end_time, ct.working_group_id, ct.order_product_id, ct.planned_number, ct.completed_number, ct.is_started FROM cutting_tasks ct INNER JOIN order_product op ON ct.order_product_id = op.id INNER JOIN products p ON op.product_id = p.id INNER JOIN products_types pt ON p.products_type_id = pt.id WHERE pt.description = 'T-shirt';",
      "execution time": "0.0019268989562988281",
      "Result of executing SQL": [
        {
          "id": "ct1",
          "start_time": "2024年01月10日 00:00",
          "end_time": "2024年01月18日 00:00",
          "working_group_id": "wg2",
          "order_product_id": "op1",
          "planned_number": 100,
          "completed_number": 100,
          "is_started": 1
        },
        {
          "id": "ct4",
          "start_time": "2024年01月10日 00:00",
          "end_time": "2024年01月17日 00:00",
          "working_group_id": "wg2",
          "order_product_id": "op4",
          "planned_number": 220,
          "completed_number": 220,
          "is_started": 1
        },
        {
          "id": "ct2",
          "start_time": "2024年01月10日 00:00",
          "end_time": "2024年02月02日 00:00",
          "working_group_id": "wg3",
          "order_product_id": "op2",
          "planned_number": 240,
          "completed_number": 240,
          "is_started": 1
        },
        {
          "id": "ct5",
          "start_time": "2024年01月10日 00:00",
          "end_time": "2024年02月02日 00:00",
          "working_group_id": "wg2",
          "order_product_id": "op5",
          "planned_number": 260,
          "completed_number": 260,
          "is_started": 1
        },
        {
          "id": "ct3",
          "start_time": "2024年01月10日 00:00",
          "end_time": "2024年01月19日 00:00",
          "working_group_id": "wg3",
          "order_product_id": "op3",
          "planned_number": 150,
          "completed_number": 150,
          "is_started": 1
        }
      ]
    }
  ],
  "answer": "Based on the provided data, the cutting tasks for products categorized as T-shirt are as follows:\n\n1. Task ID: ct1\n   - Start Time: 2024年01月10日 00:00\n   - End Time: 2024年01月18日 00:00\n   - Working Group ID: wg2\n   - Order Product ID: op1\n   - Planned Number: 100\n   - Completed Number: 100\n   - Is Started: Yes\n\n2. Task ID: ct4\n   - Start Time: 2024年01月10日 00:00\n   - End Time: 2024年01月17日 00:00\n   - Working Group ID: wg2\n   - Order Product ID: op4\n   - Planned Number: 220\n   - Completed Number: 220\n   - Is Started: Yes\n\n3. Task ID: ct2\n   - Start Time: 2024年01月10日 00:00\n   - End Time: 2024年02月02日 00:00\n   - Working Group ID: wg3\n   - Order Product ID: op2\n   - Planned Number: 240\n   - Completed Number: 240\n   - Is Started: Yes\n\n4. Task ID: ct5\n   - Start Time: 2024年01月10日 00:00\n   - End Time: 2024年02月02日 00:00\n   - Working Group ID: wg2\n   - Order Product ID: op5\n   - Planned Number: 260\n   - Completed Number: 260\n   - Is Started: Yes\n\n5. Task ID: ct3\n   - Start Time: 2024年01月10日 00:00\n   - End Time: 2024年01月19日 00:00\n   - Working Group ID: wg3\n   - Order Product ID: op3\n   - Planned Number: 150\n   - Completed Number: 150\n   - Is Started: Yes",
  "tokens": {
    "completion_tokens": "158",
    "prompt_tokens": "1837",
    "total_tokens": "1995"
  }
}